{
 "schema": "executive-summary-v1",
 "generated_time": "2026-10-24T22:10:22+08:00",
 "period": {
  "data_as_of": null,
  "events_24h": 42,
  "events_7d": 432,
  "active_countries_24h": 10,
  "active_countries_7d": 27,
  "total_countries": 22,
  "articles_7d": 331
 },
 "overall_assessment": "过去24小时共记录 42 起安全事件，涉及 10 个国家；近7日 432 起、27 个国家。事件量居前：尼日利亚 201 起/7日、乍得 60 起/7日、莫桑比克 27 起/7日。过去24小时无高严重度公开事件。",
 "risk_direction": "stable",
 "confidence": "medium",
 "key_regions": [
  {
   "country": "尼日利亚",
   "events_24h": 30,
   "events_7d": 201,
   "direction": "up",
   "note": "7日 201 起，24h 30 起"
  },
  {
   "country": "乍得",
   "events_24h": 3,
   "events_7d": 60,
   "direction": "up",
   "note": "7日 60 起，24h 3 起"
  },
  {
   "country": "莫桑比克",
   "events_24h": 1,
   "events_7d": 27,
   "direction": "flat",
   "note": "7日 27 起，24h 1 起"
  },
  {
   "country": "南苏丹",
   "events_24h": 0,
   "events_7d": 24,
   "direction": "down",
   "note": "7日 24 起，24h 0 起"
  },
  {
   "country": "加纳",
   "events_24h": 0,
   "events_7d": 23,
   "direction": "down",
   "note": "7日 23 起，24h 0 起"
  }
 ],
 "top_events": [
  {
   "country": "尼日利亚",
   "title": "尼日利亚确诊一例埃博拉病例，非洲疾控中心呼吁全球紧急支援",
   "summary": "尼日利亚确诊一例埃博拉本迪布焦型病例后，非洲疾病控制与预防中心（非洲疾控中心）呼吁国际社会提供紧急资金、医疗物资、诊断设备和受训应急人员。该中心主任让·卡塞亚表示，这一呼吁是在与尼日利亚卫生和社会福利统筹部长穆罕默德·帕特沟通后发出的。卡塞亚警告说，疫情不能扩散到更多国家或再持续一年，并称刚果（金）的病死率接近50%。",
   "time": "2026-10-20 21:12",
   "source_count": 5,
   "event_id": "EVT_df5105fd5d98f561",
   "severity": "medium"
  },
  {
   "country": "尼日利亚",
   "title": "乌干达回应尼日利亚：本国无埃博拉确诊病例",
   "summary": "乌干达卫生部表示，该国目前没有确诊的活跃埃博拉病例，呼吁公众保持冷静。此前有报道称一名尼日利亚女性在阿布贾被检测出埃博拉病毒阳性。乌干达方面称，初步信息显示该女性曾前往刚果（金）东部经商，10月初途经乌干达时未出现症状，抵达尼日利亚后才发病。乌干达表示尼日利亚尚未提供该女性的详细旅行行程和临床病史。",
   "time": "2026-10-21 07:16",
   "source_count": 4,
   "event_id": "EVT_c0f77112e37cd3ad",
   "severity": "medium"
  },
  {
   "country": "尼日利亚",
   "title": "尼日利亚阿布贾确诊一例埃博拉病例，追踪44名密切接触者",
   "summary": "尼日利亚卫生当局确认阿布贾出现一例埃博拉病毒病病例，患者为一名近期从乌干达乘国际航班抵达尼日利亚的女性，此前曾在联邦首都区一家私立医院接受治疗数日。卫生部长穆罕默德·阿里·帕特表示，患者已被隔离并接受治疗，公共卫生官员已识别44名密切接触者并展开调查。目前相关机构正协调防控工作，以防疫情进一步传播。",
   "time": "2026-10-20 17:49",
   "source_count": 4,
   "event_id": "EVT_e47a8be63e6d94d4",
   "severity": "medium"
  },
  {
   "country": "尼日利亚",
   "title": "尼日利亚出现首例埃博拉病例，当局紧急追踪接触者",
   "summary": "尼日利亚宣布发现首例本迪布焦型埃博拉病例，患者为一名从乌干达乘飞机抵达的女性。当局正争分夺秒追踪接触者，目前已发现44名潜在接触者，包括医护人员。患者症状于10月6日出现，但直到10月20日才确诊，引发对诊断延迟的担忧。",
   "time": "2026-10-22 13:04",
   "source_count": 3,
   "event_id": "EVT_aedeb909e8319148",
   "severity": "medium"
  },
  {
   "country": "贝宁",
   "title": "贝宁启动埃博拉预防机制",
   "summary": "贝宁卫生部长本杰明·洪克帕坦于2026年10月21日视察科托努的贝尔纳丹·甘坦国际机场，检查针对埃博拉病毒的卫生预防措施。尼日利亚已报告首例病例，但贝宁表示已做好防范准备。机场已安装热成像摄像头并设有隔离室，用于快速发现和处置疑似病例。",
   "time": "2026-10-22 03:18",
   "source_count": 3,
   "event_id": "EVT_d70f6aae9ef043a3",
   "severity": "medium"
  }
 ],
 "latest_intelligence": [
  {
   "title": "World Polio Day: Rotary urges parents to vaccinate children",
   "country": "尼日利亚",
   "source": "Punch",
   "time": "2026-10-24 18:45",
   "security_category": "other_security",
   "article_id": "ART_df7465ffd4cb2492",
   "translated": false
  },
  {
   "title": "Police arrest suspect over death of 23-year-old woman in Anambra",
   "country": "尼日利亚",
   "source": "Punch",
   "time": "2026-10-24 16:40",
   "security_category": "other_security",
   "article_id": "ART_54ce281c143e2568",
   "translated": false
  },
  {
   "title": "Morning recap: Ebola updates, looming petrol price hike, Lagos building collapse, other top stories",
   "country": "尼日利亚",
   "source": "Punch",
   "time": "2026-10-24 14:38",
   "security_category": "public_health",
   "article_id": "ART_d411101e56cb15bb",
   "translated": false
  },
  {
   "title": "Ebola: Traveller had no symptoms before leaving Uganda — Govt",
   "country": "尼日利亚",
   "source": "Punch",
   "time": "2026-10-24 14:11",
   "security_category": "public_health",
   "article_id": "ART_30618e4a90a1368b",
   "translated": false
  },
  {
   "title": "FG convicts 653 suspects in mass terrorism trials — AGF",
   "country": "尼日利亚",
   "source": "Punch",
   "time": "2026-10-24 12:36",
   "security_category": "terrorist_attack",
   "article_id": "ART_2ae2af65c6b9484b",
   "translated": false
  },
  {
   "title": "Robbers threatened to kill, frame me as cultist — UNILAG student",
   "country": "尼日利亚",
   "source": "Punch",
   "time": "2026-10-24 12:28",
   "security_category": "other_security",
   "article_id": "ART_df3ddf6e36072005",
   "translated": false
  },
  {
   "title": "Health workers threaten strike over unpaid allowances",
   "country": "尼日利亚",
   "source": "Punch",
   "time": "2026-10-24 12:07",
   "security_category": "other_security",
   "article_id": "ART_2ae23a0110268ed8",
   "translated": false
  },
  {
   "title": "Lagos blames developer as building collapse kills one",
   "country": "尼日利亚",
   "source": "Punch",
   "time": "2026-10-24 07:43",
   "security_category": "other_security",
   "article_id": "ART_7d4d5fecf4b150ae",
   "translated": false
  }
 ],
 "assessment": {
  "status": "deterministic",
  "based_on": "过去24小时/7日公开信息（确定性汇总）"
 },
 "sources_used": [
  "data/public/published_events.json",
  "data/canonical/articles.json",
  "data/canonical/event_clusters.json",
  "data/views/ai_intelligence.json"
 ]
}
